{
  "schema_version": "1.0.0",
  "authority": "ADR-0006-FOUR-ENGINE-ARCHITECTURE",
  "note": "Constitutional machine-readable source of truth for the four-engine architecture. The Markdown views under docs/architecture/ are human-readable projections of this file and are checked against it. Do not edit a view to disagree with this file; do not edit this file without updating the views. See docs/architecture/FOUR_ENGINE_SYSTEM_MODEL.md.",
  "engines": [
    {
      "id": "MUSICAL_CORE",
      "name": "Musical Core",
      "answers": "What is the music, and where can it be played?",
      "depends_on_none": true
    },
    {
      "id": "EDUCATIONAL_ENGINE",
      "name": "Educational Engine",
      "answers": "What does this mean for a learner?",
      "depends_on_none": false
    },
    {
      "id": "CREATIVE_ENGINE",
      "name": "Creative Engine",
      "answers": "How does a human change the music?",
      "depends_on_none": false
    },
    {
      "id": "PERFORMANCE_ENGINE",
      "name": "Performance Engine",
      "answers": "What actually happened when it was played?",
      "depends_on_none": false
    }
  ],
  "dependency_rules": [
    {"from": "MUSICAL_CORE", "to": "EDUCATIONAL_ENGINE", "relation": "prohibited"},
    {"from": "MUSICAL_CORE", "to": "CREATIVE_ENGINE", "relation": "prohibited"},
    {"from": "MUSICAL_CORE", "to": "PERFORMANCE_ENGINE", "relation": "prohibited"},
    {"from": "EDUCATIONAL_ENGINE", "to": "MUSICAL_CORE", "relation": "depends"},
    {"from": "EDUCATIONAL_ENGINE", "to": "CREATIVE_ENGINE", "relation": "prohibited"},
    {"from": "EDUCATIONAL_ENGINE", "to": "PERFORMANCE_ENGINE", "relation": "consumes_evidence"},
    {"from": "CREATIVE_ENGINE", "to": "MUSICAL_CORE", "relation": "depends"},
    {"from": "CREATIVE_ENGINE", "to": "EDUCATIONAL_ENGINE", "relation": "consumes_contracts"},
    {"from": "CREATIVE_ENGINE", "to": "PERFORMANCE_ENGINE", "relation": "prohibited"},
    {"from": "PERFORMANCE_ENGINE", "to": "MUSICAL_CORE", "relation": "depends"},
    {"from": "PERFORMANCE_ENGINE", "to": "EDUCATIONAL_ENGINE", "relation": "prohibited"},
    {"from": "PERFORMANCE_ENGINE", "to": "CREATIVE_ENGINE", "relation": "prohibited"}
  ],
  "capabilities": [
    {"id": "canonical-music", "name": "Canonical musical model", "owning_engine": "MUSICAL_CORE", "permitted_consumers": ["EDUCATIONAL_ENGINE", "CREATIVE_ENGINE", "PERFORMANCE_ENGINE"], "classification": "neither", "implementation_status": "implemented"},
    {"id": "instrument-profiles", "name": "Instrument and tuning profiles", "owning_engine": "MUSICAL_CORE", "permitted_consumers": ["EDUCATIONAL_ENGINE", "CREATIVE_ENGINE", "PERFORMANCE_ENGINE"], "classification": "neither", "implementation_status": "implemented"},
    {"id": "msme", "name": "Musical Spatial Mapping Engine", "owning_engine": "MUSICAL_CORE", "permitted_consumers": ["EDUCATIONAL_ENGINE", "CREATIVE_ENGINE"], "classification": "neither", "implementation_status": "partial"},
    {"id": "candidate-generation", "name": "Candidate generation", "owning_engine": "MUSICAL_CORE", "permitted_consumers": ["EDUCATIONAL_ENGINE", "CREATIVE_ENGINE"], "classification": "evidence", "implementation_status": "implemented"},
    {"id": "deterministic-selection", "name": "Deterministic selection", "owning_engine": "MUSICAL_CORE", "permitted_consumers": ["EDUCATIONAL_ENGINE", "CREATIVE_ENGINE"], "classification": "evidence", "implementation_status": "planned"},
    {"id": "spatial-evidence", "name": "Spatial evidence", "owning_engine": "MUSICAL_CORE", "permitted_consumers": ["EDUCATIONAL_ENGINE"], "classification": "evidence", "primary_contract": "SpatialEvidenceV1", "implementation_status": "planned"},
    {"id": "mechanical-phrase-planning", "name": "Mechanical phrase and chord planning", "owning_engine": "MUSICAL_CORE", "permitted_consumers": ["EDUCATIONAL_ENGINE"], "classification": "neither", "implementation_status": "planned"},
    {"id": "piano-roll-projection", "name": "Piano-roll projection (semantic)", "owning_engine": "MUSICAL_CORE", "permitted_consumers": ["CREATIVE_ENGINE", "EDUCATIONAL_ENGINE"], "classification": "neither", "implementation_status": "planned"},
    {"id": "notation-projection", "name": "Notation projection (semantic)", "owning_engine": "MUSICAL_CORE", "permitted_consumers": ["CREATIVE_ENGINE", "EDUCATIONAL_ENGINE"], "classification": "neither", "implementation_status": "planned"},
    {"id": "tab-projection", "name": "TAB projection (semantic)", "owning_engine": "MUSICAL_CORE", "permitted_consumers": ["CREATIVE_ENGINE", "EDUCATIONAL_ENGINE"], "classification": "neither", "implementation_status": "planned"},
    {"id": "midi-projection", "name": "MIDI projection (semantic)", "owning_engine": "MUSICAL_CORE", "permitted_consumers": ["CREATIVE_ENGINE", "PERFORMANCE_ENGINE"], "classification": "neither", "implementation_status": "planned"},
    {"id": "learning-objects", "name": "Learning Objects", "owning_engine": "EDUCATIONAL_ENGINE", "permitted_consumers": ["CREATIVE_ENGINE"], "classification": "neither", "implementation_status": "planned"},
    {"id": "lesson-assignments", "name": "Lesson assignments", "owning_engine": "EDUCATIONAL_ENGINE", "permitted_consumers": ["CREATIVE_ENGINE"], "classification": "neither", "primary_contract": "LessonAssignmentV1", "implementation_status": "implemented"},
    {"id": "curriculum", "name": "Curriculum", "owning_engine": "EDUCATIONAL_ENGINE", "permitted_consumers": [], "classification": "neither", "implementation_status": "planned"},
    {"id": "etudes", "name": "Etudes", "owning_engine": "EDUCATIONAL_ENGINE", "permitted_consumers": [], "classification": "neither", "implementation_status": "planned"},
    {"id": "reference-material", "name": "Reference material", "owning_engine": "EDUCATIONAL_ENGINE", "permitted_consumers": [], "classification": "neither", "implementation_status": "planned"},
    {"id": "learning-paths", "name": "Learning paths", "owning_engine": "EDUCATIONAL_ENGINE", "permitted_consumers": [], "classification": "neither", "implementation_status": "planned"},
    {"id": "educational-interpretation", "name": "Educational interpretation", "owning_engine": "EDUCATIONAL_ENGINE", "permitted_consumers": ["CREATIVE_ENGINE"], "classification": "interpretation", "primary_contract": "EducationalInterpretationV1", "implementation_status": "planned"},
    {"id": "practice-evaluation", "name": "Practice evaluation", "owning_engine": "EDUCATIONAL_ENGINE", "permitted_consumers": ["CREATIVE_ENGINE"], "classification": "interpretation", "primary_contract": "PracticeEvaluationResultV1", "implementation_status": "implemented"},
    {"id": "teaching-guidance-projection", "name": "Teaching guidance projection", "owning_engine": "EDUCATIONAL_ENGINE", "permitted_consumers": ["CREATIVE_ENGINE"], "classification": "interpretation", "primary_contract": "TeachingGuidanceProjectionV1", "implementation_status": "implemented"},
    {"id": "difficulty", "name": "Difficulty estimation", "owning_engine": "EDUCATIONAL_ENGINE", "permitted_consumers": ["CREATIVE_ENGINE"], "classification": "interpretation", "implementation_status": "planned"},
    {"id": "coaching", "name": "Coaching", "owning_engine": "EDUCATIONAL_ENGINE", "permitted_consumers": [], "classification": "interpretation", "primary_contract": "CoachingRecommendationV1", "implementation_status": "planned"},
    {"id": "assessment", "name": "Assessment", "owning_engine": "EDUCATIONAL_ENGINE", "permitted_consumers": [], "classification": "interpretation", "implementation_status": "planned"},
    {"id": "practice-metrics", "name": "Practice metrics", "owning_engine": "EDUCATIONAL_ENGINE", "permitted_consumers": [], "classification": "interpretation", "implementation_status": "planned"},
    {"id": "progress", "name": "Progress tracking", "owning_engine": "EDUCATIONAL_ENGINE", "permitted_consumers": [], "classification": "interpretation", "implementation_status": "planned"},
    {"id": "pedagogical-sequencing", "name": "Pedagogical phrase-plan sequencing", "owning_engine": "EDUCATIONAL_ENGINE", "permitted_consumers": [], "classification": "interpretation", "implementation_status": "planned"},
    {"id": "smart-score-entry", "name": "Smart Score Entry", "owning_engine": "CREATIVE_ENGINE", "permitted_consumers": [], "classification": "neither", "implementation_status": "planned"},
    {"id": "composition", "name": "Composition", "owning_engine": "CREATIVE_ENGINE", "permitted_consumers": [], "classification": "neither", "implementation_status": "planned"},
    {"id": "arrangement", "name": "Arrangement", "owning_engine": "CREATIVE_ENGINE", "permitted_consumers": [], "classification": "neither", "implementation_status": "planned"},
    {"id": "semantic-edit-proposals", "name": "Semantic score-edit proposals", "owning_engine": "CREATIVE_ENGINE", "permitted_consumers": [], "classification": "neither", "implementation_status": "planned"},
    {"id": "score-authoring-ux", "name": "Score-authoring UX", "owning_engine": "CREATIVE_ENGINE", "permitted_consumers": [], "classification": "neither", "implementation_status": "planned"},
    {"id": "direct-precision-editing", "name": "Direct precision editing", "owning_engine": "CREATIVE_ENGINE", "permitted_consumers": [], "classification": "neither", "implementation_status": "planned"},
    {"id": "live-capture", "name": "Live capture", "owning_engine": "PERFORMANCE_ENGINE", "permitted_consumers": ["EDUCATIONAL_ENGINE"], "classification": "evidence", "primary_contract": "PerformanceObservationV1", "implementation_status": "planned"},
    {"id": "playback", "name": "Playback", "owning_engine": "PERFORMANCE_ENGINE", "permitted_consumers": [], "classification": "neither", "implementation_status": "planned"},
    {"id": "performance-sessions", "name": "Performance sessions", "owning_engine": "PERFORMANCE_ENGINE", "permitted_consumers": ["EDUCATIONAL_ENGINE"], "classification": "evidence", "implementation_status": "planned"},